created_at,is_retweet,text,tweet_id
Mon May 07 17:48:00 +0000 2018,False,Gina Haspel is the best choice for CIA Director: https://t.co/nK7zwbeAQW,Pre-Update
Tue May 08 19:03:05 +0000 2018,False,"""At the heart of the Iran deal was a giant fiction: that a murderous regime desired only a peaceful nuclear energy… https://t.co/elKYqynZQU",Pre-Update
Mon May 07 14:46:51 +0000 2018,True,"RT @PressSec: ICYMI: @POTUS appointed members to his Council on on Sports, Fitness, and Nutrition, which aims to encourage youth participat…",Pre-Update
Mon May 07 19:03:13 +0000 2018,True,RT @FLOTUS: #BeBest 🇺🇸 https://t.co/ziI09BW4i1,Pre-Update
Tue May 08 18:34:29 +0000 2018,False,"""We will be instituting the highest level of economic sanction. Any nation that helps Iran in its quest for nuclear… https://t.co/paT9mmPlXT",Pre-Update
Mon May 07 20:39:00 +0000 2018,False,"""So today I’m very excited to announce Be Best, an awareness campaign dedicated to the most valuable and fragile am… https://t.co/bY80DJQ7RA",Pre-Update
Tue May 08 15:49:00 +0000 2018,True,RT @PressSec: America needs a strong leader at the CIA! Gina Haspel has spent 33 years protecting the homeland. She has the experience. She…,Pre-Update
Tue May 08 15:27:35 +0000 2018,True,RT @FLOTUS: Thank you to all who attended yesterday’s launch of #BeBest. I will continue focusing on ways to help children be their best se…,Pre-Update
Mon May 07 19:01:06 +0000 2018,False,Watch LIVE as @FLOTUS Melania Trump launches her initiative: https://t.co/EmsdctGWtd https://t.co/TkPfQCtv2d,Pre-Update
Tue May 08 18:55:22 +0000 2018,False,President Trump is committed to ensuring Iran has no possible path to a nuclear weapon and is addressing the threat… https://t.co/gb8VJkPCsn,Pre-Update
Wed May 09 12:38:00 +0000 2018,False,"Despite repeatedly facing false or misleading allegations against her, the facts show that Gina Haspel has served h… https://t.co/wgmowgdDs4",Pre-Update
Thu May 10 10:02:21 +0000 2018,True,"RT @realDonaldTrump: On behalf of the American people, WELCOME HOME! https://t.co/hISaCI95CB",Pre-Update
Wed May 09 13:42:00 +0000 2018,False,A number of public officials have put country above party to support Gina Haspel’s nomination. The Senate should ag… https://t.co/ZhtBSyNVpe,Pre-Update
Thu May 10 00:23:01 +0000 2018,False,Check out tonight's edition of West Wing Reads: https://t.co/gsEaqmFlt1 https://t.co/P42XioAwCQ,Pre-Update
Wed May 09 00:23:01 +0000 2018,False,"Matthew Continetti in The Washington Free Beacon: ""Donald Trump Ends the Obama Mirage"" 

Read more in tonight's edi… https://t.co/o9mvi86so5",Pre-Update
Thu May 10 15:36:02 +0000 2018,False,"Earlier this morning, President Trump welcomed home three American returnees from North Korea. “They are really thr… https://t.co/GpZFgdvuEm",Pre-Update
Thu May 10 23:41:01 +0000 2018,False,Tonight's edition of West Wing Reads: https://t.co/JQNbdIEKe2 https://t.co/ZOImgySfnp,Pre-Update
Wed May 09 14:48:01 +0000 2018,False,Gina Haspel has developed outstanding intelligence expertise and understanding during her distinguished career at t… https://t.co/brn9UTQPVu,Pre-Update
Wed May 09 20:14:00 +0000 2018,False,"Today, President Trump issued an executive order to enhance opportunities for military spouses looking for employme… https://t.co/EIvxAVrtVb",Pre-Update
Wed May 09 15:12:00 +0000 2018,False,Gina Haspel is the right person to lead the CIA and the Senate should confirm her as swiftly as possible. https://t.co/ZP98kkNc87,Pre-Update
Thu May 10 16:09:02 +0000 2018,False,"The Iran Deal Was Betrayed by Its Own Abysmal Record: ""[President Trump] decided that this deal actually undermines… https://t.co/AU1AZPUsb5",Pre-Update
Wed May 09 23:28:00 +0000 2018,True,"RT @realDonaldTrump: The Failing New York Times criticized Secretary of State Pompeo for being AWOL (missing), when in fact he was flying t…",Pre-Update
Thu May 10 08:31:03 +0000 2018,True,RT @hogangidley45: Home with hands raised...The returnees from North Korea stand free on American soil with @realDonaldTrump @POTUS and @FL…,Pre-Update
Thu May 10 19:46:01 +0000 2018,False,What They Are Saying: the Trump Administration secures the release of three Americans from North Korea https://t.co/GLeYW815Hv,Pre-Update
Fri May 11 14:54:34 +0000 2018,True,RT @SecAzar: Looking forward to joining @POTUS at the @WhiteHouse for his remarks on lowering prescription drug prices. Watch live at 2PM E…,Pre-Update
Thu May 10 02:45:50 +0000 2018,True,RT @SecPompeo: I had the chance to watch Acting CIA Director Gina Haspel testify. I’m looking forward to receiving intelligence as Secretar…,Pre-Update
Wed May 09 15:33:01 +0000 2018,False,"Yesterday, President Trump announced that America will withdraw from the Iran nuclear deal. The agreement has faile… https://t.co/3fX8mXDER1",Pre-Update
Wed May 09 13:37:00 +0000 2018,True,RT @PressSec: A positive gesture brings incredible news for three American families. https://t.co/t6uJU1MoqF,Pre-Update
Thu May 10 02:45:32 +0000 2018,True,RT @realDonaldTrump: Gina Haspel did a spectacular job today. There is nobody even close to run the CIA!,Pre-Update
Thu May 10 06:12:01 +0000 2018,False,Watch LIVE as President Trump and Vice President Pence welcome home Secretary of State Pompeo and three American re… https://t.co/2wJgbhDggB,Pre-Update
Wed May 09 22:24:11 +0000 2018,True,RT @FLOTUS: We had a wonderful celebration @Whitehouse today to honor some incredible military moms for #MothersDay. My heart &amp; continued p…,Pre-Update
Wed May 09 17:31:01 +0000 2018,False,"Gina Haspel continues to gather widespread support for her impeccable qualifications and dedication, making it clea… https://t.co/JchfFJEJeD",Pre-Update
Thu May 10 08:31:24 +0000 2018,True,"RT @Scavino45: May 10, 2018 | 3:05amE
Behind-the-scenes atmosphere at Joint Base Andrews — on this early historical morning... https://t.co…",Pre-Update
Wed May 09 13:08:01 +0000 2018,False,Gina Haspel is strongly qualified to lead the CIA and has the support of the dedicated career civil servants at the… https://t.co/GklMg9KvGa,Pre-Update
Wed May 09 14:15:44 +0000 2018,False,"""During @SecPompeo’s visit, the North Korean leadership released three American detainees."" Statement from… https://t.co/jEGNbObyuj",Pre-Update
Thu May 10 14:39:32 +0000 2018,True,RT @realDonaldTrump: The highly anticipated meeting between Kim Jong Un and myself will take place in Singapore on June 12th. We will both…,Pre-Update
Thu May 10 08:32:49 +0000 2018,True,RT @LWalters45: The three American returnees held in North Korea are back home - hands raised and standing free on American soil @POTUS #Jo…,Pre-Update
Thu May 10 21:39:00 +0000 2018,False,"In a victory for the world, President Trump secured the release of three brave Americans, who have safely returned… https://t.co/NpWcw9bbyP",Pre-Update
Wed May 09 14:31:00 +0000 2018,False,"Service in the CIA is largely quiet, behind-the-scenes work to keep America safe. The names of these men and women… https://t.co/aGAxxc2iNs",Pre-Update
Wed May 09 20:39:01 +0000 2018,False,President Trump is enhancing opportunities for military families. More: https://t.co/moNsW8HLwJ https://t.co/iNB1Go1Wkk,Pre-Update
Thu May 10 12:34:51 +0000 2018,False,"The U.S. condemns the Iranian regime’s provocative rocket attacks from Syria against Israeli citizens, and we stron… https://t.co/kvHrzc3pZ8",Pre-Update
Wed May 09 20:23:01 +0000 2018,False,"While our men and women in uniform serve our country on base or abroad, their spouses face many challenges to build… https://t.co/j71PDVuFSf",Pre-Update
Fri May 11 15:21:03 +0000 2018,False,Military spouses are the foundation of our Nation's military families and today we honor their countless sacrifices… https://t.co/VgmrkX0VeT,Pre-Update
Wed May 09 23:28:10 +0000 2018,True,RT @realDonaldTrump: Looking forward to greeting the Hostages (no longer) at 2:00 A.M.,Pre-Update
Wed May 09 12:34:08 +0000 2018,True,RT @realDonaldTrump: I am pleased to inform you that Secretary of State Mike Pompeo is in the air and on his way back from North Korea with…,Pre-Update
Thu May 10 19:11:01 +0000 2018,False,"President Trump's decision to withdraw from the Iran nuclear deal ""reversed an ill-advised &amp; dangerous policy &amp; set… https://t.co/RXxJsht9xy",Pre-Update
Thu May 10 17:46:01 +0000 2018,False,Support for President Trump’s decision to end United States participation in the Iran deal: https://t.co/YC80JGYzgs,Pre-Update
Thu May 10 07:11:44 +0000 2018,True,RT @PressSec: .@POTUS lands at JBA to welcome home the three returnees - incredible night for America. https://t.co/SH2m9LoQ43,Pre-Update
Thu May 10 15:03:38 +0000 2018,True,"RT @VP: I let Otto Warmbier’s family know that while we receive this news with joy, that Otto was in all of our hearts and their family was…",Pre-Update
Wed May 09 19:24:34 +0000 2018,False,Watch LIVE as President Trump participates in the Celebration of Military Mothers and Spouses event:… https://t.co/4tYaR4LJvk,Pre-Update
Sun May 13 13:06:01 +0000 2018,False,"Happy #MothersDay! Today, and every day, let us express our utmost respect, admiration, and appreciation for our mo… https://t.co/SvGNEt4zSn",Pre-Update
Sat May 12 15:39:00 +0000 2018,False,A number of public officials have put country above party to support Gina Haspel’s nomination for CIA Director. Mor… https://t.co/wPrpZZdM6n,Pre-Update
Fri May 11 19:31:55 +0000 2018,True,"RT @realDonaldTrump: Today, my Administration is launching the most sweeping action in history to lower the price of prescription drugs for…",Pre-Update
Fri May 11 20:57:18 +0000 2018,True,RT @realDonaldTrump: The American people deserve a healthcare system that takes care of them – not one that takes advantage of them. We wil…,Pre-Update
Fri May 11 19:50:01 +0000 2018,False,.@US_FDA's 2017 generic drug approvals contributed to prescription drug buyers saving $8.8 billion. These dramatic… https://t.co/KjqmngTjHI,Pre-Update
Sun May 13 17:45:13 +0000 2018,True,"RT @AmbDermer: 69 Today, on Jerusalem Day, we honor @POTUS Trump whose bold decision to recognize Jerusalem as Israel’s capital and move th…",Pre-Update
Fri May 11 17:16:00 +0000 2018,False,"""But securing the benefits of 21st century medicine demands major changes to how our country pays for prescription… https://t.co/7y2D1nGMRd",Pre-Update
Sun May 13 14:03:00 +0000 2018,False,"""Since the earliest days of our republic, America's strength has come from the love and courage and devotion of our… https://t.co/40xT0PHo0T",Pre-Update
Sat May 12 13:43:02 +0000 2018,False,"After a strong showing at her confirmation hearing, editorial boards and commentators are calling for bipartisan su… https://t.co/l5WNblN1u9",Pre-Update
Fri May 11 18:32:00 +0000 2018,False,President Trump’s blueprint includes new actions and proposals to drive down drug prices for all Americans. https://t.co/2y1dwgtYWW,Pre-Update
Sun May 13 09:36:32 +0000 2018,True,"RT @usembassyjlm: For 70 years, the United States and Israel have developed a partnership unlike any other. We are proud to be at the foref…",Pre-Update
Fri May 11 20:36:00 +0000 2018,False,.@SecAzar stopped by today's press briefing to lay out the President's blueprint to lower prescription drug prices.… https://t.co/q8z9o6rPdN,Pre-Update
Fri May 11 18:01:16 +0000 2018,False,Watch LIVE as President Trump delivers remarks on lowering drug prices: https://t.co/EmsdctGWtd https://t.co/pVR3QLM3vj,Pre-Update
Fri May 11 19:42:35 +0000 2018,True,RT @SecAzar: Our blueprint brings the latest negotiation tools to our government programs so we can get the best deals for American patient…,Pre-Update
Fri May 11 19:04:01 +0000 2018,False,The blueprint will build upon actions President Trump’s Administration has already taken to increase competition an… https://t.co/CenPnAZ8HO,Pre-Update
Sun May 13 12:31:18 +0000 2018,True,RT @realDonaldTrump: Happy Mother’s Day!!! https://t.co/zw71dnT7TJ,Pre-Update
Sat May 12 18:22:00 +0000 2018,False,"The way forward, President Trump said, is for the United States to work with its allies to find a lasting solution… https://t.co/7OlYdRRZug",Pre-Update
Mon May 14 15:45:40 +0000 2018,True,"RT @jdgreenblatt45: Promise made. Promise kept. @POTUS had the moral clarity and strength to do what was right. From this day forward, the…",Pre-Update
Mon May 14 17:13:00 +0000 2018,False,President Trump kept his promise by recognizing Jerusalem as Israel’s capital and opening @usembassyjlm:… https://t.co/tb6TrHoV7l,Pre-Update
Mon May 14 19:49:01 +0000 2018,False,"After announcing the United States’ recognition of Jerusalem as the capital of Israel, President Trump quickly and… https://t.co/Wrln6AKUvX",Pre-Update
Mon May 14 14:53:40 +0000 2018,True,"RT @VP: Today, thanks to the leadership of @POTUS, we celebrate history in the making... the opening of the US Embassy in Jerusalem, the ca…",Pre-Update
Mon May 14 15:17:12 +0000 2018,True,RT @realDonaldTrump: #USEmbassyJerusalem https://t.co/f1SFvrkcAH,Pre-Update
Mon May 14 13:28:38 +0000 2018,False,"""On December 6th, 2017, at my direction, the United States finally and officially recognized Jerusalem as the true… https://t.co/R693EMkIPr",Pre-Update
Mon May 14 22:53:12 +0000 2018,False,"On behalf of all White House Staff, we are thankful for @FLOTUS' successful procedure and wish her a swift recovery.",Pre-Update
Mon May 14 21:10:12 +0000 2018,True,"RT @realDonaldTrump: Heading over to Walter Reed Medical Center to see our great First Lady, Melania. Successful procedure, she is in good…",Pre-Update
Mon May 14 21:09:39 +0000 2018,True,RT @VP: .@SecondLady &amp; I are relieved that our dear friend @FLOTUS’ medical procedure was successful &amp; are praying for her swift recovery.…,Pre-Update
Mon May 14 16:30:34 +0000 2018,False,"The U.S. officially opened its embassy in Jerusalem, Israel—a move that fulfills one of President Trump’s signature… https://t.co/WaL4dWUp3X",Pre-Update
Mon May 14 13:00:48 +0000 2018,False,Watch LIVE the dedication of @usembassyjlm: https://t.co/KVhxC50Ywe #USEmbassyJerusalem,Pre-Update
Mon May 14 20:19:01 +0000 2018,False,The Trump Administration continues to work to achieve a comprehensive peace agreement between the Israelis and the… https://t.co/O9sXJjZSFh,Pre-Update
Tue May 15 00:11:01 +0000 2018,False,Check out tonight's edition of West Wing Reads: https://t.co/LQ8zxKAl2M https://t.co/0bz43fPAdV,Pre-Update
Tue May 15 16:19:37 +0000 2018,True,"RT @USUN: “I ask my colleagues here in the Security Council, who among us would accept this type of activity on your border? No one would.”…",Pre-Update
Tue May 15 15:21:00 +0000 2018,False,Watch LIVE as President Trump delivers remarks at the 37th Annual National Peace Officers’ Memorial Service:… https://t.co/6VBFc4OtP2,Pre-Update
Tue May 15 15:05:23 +0000 2018,False,"Yesterday, President Trump fulfilled a signature campaign promise by officially opening the new @usembassyjlm. He h… https://t.co/RxykWt2RpU",Pre-Update
Tue May 15 18:59:53 +0000 2018,True,RT @realDonaldTrump: #PeaceOfficersMemorialDay https://t.co/agxulpPyag,Pre-Update
Tue May 15 19:27:02 +0000 2018,False,A number of public officials have put country above party to support Gina Haspel’s nomination for CIA Director. Mor… https://t.co/z7TQi9ZBgf,Pre-Update
Tue May 15 16:17:45 +0000 2018,True,RT @PressSec: Prayers for our amazing First Lady! https://t.co/8kqOD8C2Uq,Pre-Update
Tue May 15 23:49:01 +0000 2018,False,Tonight's edition of West Wing Reads: https://t.co/ELdQS2tnWO https://t.co/23DerUTRk5,Pre-Update
Tue May 15 20:48:00 +0000 2018,False,"""When danger came, when darkness fell, when destruction loomed, they did not flinch. They were not afraid... They l… https://t.co/Q2sxKfMK5p",Pre-Update
Tue May 15 18:42:07 +0000 2018,True,RT @realDonaldTrump: Today is one of the most important and solemn occasions of the year – the day we pay tribute to the Law Enforcement He…,Pre-Update
Thu May 17 21:07:28 +0000 2018,True,"RT @realDonaldTrump: Congratulations to our new CIA Director, Gina Haspel! https://t.co/n1xj9LSV9D",Pre-Update
Thu May 17 15:04:04 +0000 2018,False,"Yesterday, President Trump met with local officials who spoke first-hand about how these sanctuary policies jeopard… https://t.co/8FxT3ufeIm",Pre-Update
Thu May 17 20:39:18 +0000 2018,False,"""...we have six of the biggest news outlets in the United States promoting the narrative that Trump called illegal… https://t.co/qfBif3nxPJ",Pre-Update
Thu May 17 19:43:38 +0000 2018,True,"RT @Scavino45: The first 12 seconds, below - that magically went missing in newsrooms across America — regarding POTUS comments on MS-13 be…",Pre-Update
Thu May 17 17:11:00 +0000 2018,False,"Yesterday, President Trump met with local officials from California who spoke first-hand about how sanctuary polici… https://t.co/SXxnOsSlni",Pre-Update
Wed May 16 23:01:25 +0000 2018,True,RT @realDonaldTrump: Gina Haspel is one step closer to leading our brave men and women at the CIA. She is exceptionally qualified and the S…,Pre-Update
Thu May 17 14:32:00 +0000 2018,False,California and other sanctuary jurisdictions are openly obstructing Federal efforts to take custody of and remove c… https://t.co/pW7tXTpKGK,Pre-Update
Wed May 16 14:11:03 +0000 2018,False,"Today, President Trump will welcome President Mirziyoyev of the Republic of Uzbekistan to the White House. https://t.co/rebYQ3cAOs",Pre-Update
Wed May 16 17:58:19 +0000 2018,True,"RT @realDonaldTrump: Today, it was my great honor to welcome President Mirziyoyev of Uzbekistan to the @WhiteHouse! https://t.co/3EkHChjnYA",Pre-Update
Wed May 16 15:42:16 +0000 2018,False,"""Trump supporters across America: The president is delivering on his agenda"" https://t.co/8fQxJodfA5",Pre-Update
Wed May 16 16:03:02 +0000 2018,False,"This morning, the Senate Intelligence Committee voted to recommend Gina Haspel's confirmation as CIA Director to th… https://t.co/ngHHAMKFCH",Pre-Update
Wed May 16 19:57:00 +0000 2018,False,Communities are coming out against reckless sanctuary policies and in support of our Federal immigration laws that… https://t.co/XP7loBTLMp,Pre-Update
Wed May 16 23:53:01 +0000 2018,False,Tonight's edition of West Wing Reads: https://t.co/otGR2NP1Vg https://t.co/nWvKItKdUI,Pre-Update
Thu May 17 18:39:50 +0000 2018,True,"RT @Scavino45: 🚨Happening Now:
Expanded Bilateral Meeting with the Secretary General of @NATO, @jensstoltenberg...in the @Cabinet Room of t…",Pre-Update
Wed May 16 20:02:03 +0000 2018,True,RT @FLOTUS: A sincere thank you to Walter Reed Medical Unit @WRBethesda &amp; to all who have send good wishes &amp; prayers! I am feeling great &amp;…,Pre-Update
Thu May 17 00:02:00 +0000 2018,False,"Today, President Trump met with mayors, sheriffs, and local state leaders from across the state of California to di… https://t.co/a6M8zLtACz",Pre-Update
Thu May 17 22:30:00 +0000 2018,True,RT @realDonaldTrump: It was my great honor to visit with our HEROES last night at Walter Reed Medical Center. There is nobody like them! ht…,Pre-Update
Thu May 17 23:53:01 +0000 2018,False,Read more in tonight's edition of West Wing Reads: https://t.co/7jyF6iCAa0 https://t.co/9LkgDdoJku,Pre-Update
Thu May 17 23:20:30 +0000 2018,False,#Laurel? #Yanny? Or... https://t.co/5hth07SdGY,Pre-Update
Thu May 17 22:20:34 +0000 2018,True,"RT @realDonaldTrump: Talking trade with the Vice Premier of the People’s Republic of China, Liu He. https://t.co/9T7Iq6F3Xe",Pre-Update
Fri May 18 16:21:45 +0000 2018,False,"""We grieve for the terrible loss of life and send our support and love to everyone affected by this absolutely horr… https://t.co/hhyJny5R2t",Pre-Update
Fri May 18 15:07:12 +0000 2018,True,RT @FLOTUS: My heart goes out to Santa Fe and all of Texas today.,Pre-Update
Fri May 18 13:31:00 +0000 2018,True,RT @netanyahu: #Laurel? #Yanny? We hear Jerusalem! https://t.co/2tR8pcSxKI,Pre-Update
Fri May 18 14:58:02 +0000 2018,False,Watch LIVE as President Trump delivers remarks at the Prison Reform Summit: https://t.co/EmsdctGWtd https://t.co/z1jMKZ8v1F,Pre-Update
Fri May 18 20:24:10 +0000 2018,True,RT @realDonaldTrump: America is a Nation that believes in the power of redemption. America is a Nation that believes in second chances - an…,Pre-Update
Sat May 19 13:54:01 +0000 2018,True,RT @VP: #ArmedForcesDay is a time for every American to show our profound gratitude for the courageous men and women who have stepped up to…,Pre-Update
Fri May 18 15:07:25 +0000 2018,True,RT @realDonaldTrump: School shooting in Texas. Early reports not looking good. God bless all!,Pre-Update
Sat May 19 19:15:56 +0000 2018,True,RT @realDonaldTrump: Great to have our incredible First Lady back home in the White House. Melania is feeling and doing really well. Thank…,Pre-Update
Sat May 19 18:05:26 +0000 2018,True,RT @realDonaldTrump: Happy #ArmedForcesDay to our GREAT military men and women for their selfless service to our Nation! https://t.co/jbJvr…,Pre-Update
Sat May 19 16:42:01 +0000 2018,False,"On #ArmedForcesDay, we pay tribute to the extraordinary men and women who serve our Nation with valor and distincti… https://t.co/Vk7Dah9m9L",Pre-Update
Mon May 21 21:21:01 +0000 2018,False,"President Trump supports prison reform legislation to reduce prisoner recidivism rates.

Read more about how this c… https://t.co/Q0Ch3FLJUs",Pre-Update
Mon May 21 23:05:01 +0000 2018,False,"Alex Pappas in Fox News: “Gina Haspel sworn in as CIA director”

These and other articles we are reading today:… https://t.co/16ZblPnqpk",Pre-Update
Thu May 24 02:04:00 +0000 2018,False,"President Trump’s entire Administration is working tirelessly to bring these violent animals to justice. 

Here is… https://t.co/E1URTI01hx",Pre-Update
Wed May 23 22:22:00 +0000 2018,False,"President Trump Lambastes MS-13: “They’re Animals, Animals.” 

Read more in tonight's edition of West Wing Reads: https://t.co/Ri4zCLwaPI",Pre-Update
Wed May 23 18:01:38 +0000 2018,False,"President Trump participates in a Roundtable on Immigration.

Watch live: https://t.co/EmsdctGWtd https://t.co/To7Bbc9ZP5",Pre-Update
Tue May 22 23:31:01 +0000 2018,False,"President Trump delivers remarks at the Susan B. Anthony List 11th Annual Campaign for Life Gala.

Watch live ➡️… https://t.co/7aI0v9bTKi",Pre-Update
Tue May 22 23:14:01 +0000 2018,False,"Susan B. Anthony List President Marjorie Dannenfelser: ""Trump Takes Taxpayers Out of the Abortion Business""

Read m… https://t.co/Mq6CqvFJKg",Pre-Update
Sat May 19 19:17:00 +0000 2018,False,America’s immigration challenge does not end at our doorstep. Because of “sanctuary city” jurisdictions—many recent… https://t.co/a1jnDiANAv,Pre-Update
Thu May 24 02:04:00 +0000 2018,False,"President Trump’s entire Administration is working tirelessly to bring these violent animals to justice. 

Here is… https://t.co/E1URTI01hx",999471043256385538
Fri May 25 02:16:44 +0000 2018,True,"RT @Scavino45: Last week after visiting FLOTUS Melania, POTUS Trump went to visit wounded HEROES at Walter Reed Medical Center. He told the…",999836635679416321
Fri May 25 17:26:31 +0000 2018,True,"RT @realDonaldTrump: On behalf of the American People, CONGRATULATIONS! We love you! https://t.co/YRlj0vRXwk",1000065590831312896
Mon May 21 16:46:02 +0000 2018,False,President Trump is listening to America’s agriculture community and fueling the economy through pro-growth policies… https://t.co/KH5JGfijDU,998605848787214336
Wed May 23 19:42:01 +0000 2018,False,"Transnational gangs, such as MS-13, take advantage of our porous borders and seek to use our current immigration sy… https://t.co/Xz6vnABNjq",999374913088688133
Thu May 24 17:27:01 +0000 2018,False,Providing community lenders with relief from unnecessary regulatory burdens will help promote even greater economic… https://t.co/G3yUPaKwNT,999703327314268161
Tue May 22 22:23:01 +0000 2018,False,"Jim Norman writes in Gallup: ""Optimism About Availability of Good Jobs Hits New Heights"" https://t.co/2xMv9QIhEo https://t.co/GZvVg5zOuV",999053041709015041
Thu May 24 16:39:02 +0000 2018,False,"President Trump is committed to protecting our communities from the violence of MS-13, a transnational gang with th… https://t.co/OpRenPxU4D",999691253947170816
Wed May 23 19:26:01 +0000 2018,False,"President Trump’s Administration is fighting back against MS-13, by taking a wide range of actions against the gang… https://t.co/Rv44yXKfuD",999370886535942144
Sat May 26 17:51:01 +0000 2018,False,"""Words cannot measure the depth of their devotion, the purity of their love, or the totality of their courage. We o… https://t.co/XXumIA26Yq",1000434144885772289
Thu May 24 13:46:21 +0000 2018,False,"A letter from the President to Chairman Kim Jong Un: ""It is inappropriate, at this time, to have this long-planned… https://t.co/QqnMVipAtY",999647796218269697
Sun May 20 16:19:00 +0000 2018,False,"Under the guise of being pro-immigrant, “sanctuary” jurisdictions privilege a small group of criminals at the expen… https://t.co/o038FexGft",998236659685748736
Tue May 22 18:25:04 +0000 2018,True,"RT @realDonaldTrump: Today, it was my great honor to welcome President Moon Jae-in of the Republic of Korea to the @WhiteHouse!🇺🇸🇰🇷 https:/…",998993161035964416
